Service,Subject,Template
Digital Marketing,Boost Your Online Presence with Expert Digital Marketing Services!,"Hi [Recipient's Name],<br><br>I hope this email finds you well. As a business located in [Lead_Location], it's crucial to have a strong online presence to attract and engage potential customers. At [Your Company], we specialize in comprehensive digital marketing services tailored to meet your unique business needs.<br><br>Our services include:<br>- **SEO Optimization:** Improve your website's visibility and organic search rankings, driving more traffic and potential customers.<br>- **Social Media Marketing:** Engage with your audience on platforms like Facebook, Instagram, and LinkedIn, building a loyal customer base.<br>- **PPC Campaigns:** Target specific audiences with precision, maximizing your ROI and increasing conversions.<br>- **Content Marketing:** Craft compelling content that resonates with your audience and establishes your brand as an industry authority.<br><br>Let's schedule a call to discuss how we can help you enhance your online presence and achieve your business goals. Feel free to check our website [Lead_Website] and see our client testimonials and case studies.<br><br>Looking forward to our conversation.<br><br>Best regards,<br>[Your Name]"
Web Development,Transform Your Website into a Lead-Generating Machine,"Hi [Recipient's Name],<br><br>Is your website effectively converting visitors into customers? At [Your Company], we offer cutting-edge web development services that transform your online presence. Located in [Lead_Location], we understand the local market and can tailor our solutions to meet your needs.<br><br>Our web development services include:<br>- **Responsive Design:** Ensuring your website looks great on all devices, from desktops to smartphones.<br>- **SEO Integration:** Building SEO-friendly websites that rank well in search engine results.<br>- **User Experience (UX) Design:** Creating intuitive and engaging user interfaces that keep visitors on your site.<br>- **E-commerce Solutions:** Developing robust online stores that drive sales and provide a seamless shopping experience.<br><br>Interested in a free consultation to discuss how we can help your business thrive online? Visit [Lead_Website] to learn more about our services and success stories.<br><br>Cheers,<br>[Your Name]"
Graphic Design,Elevate Your Brand with Professional Graphic Design Services,"Hi [Recipient's Name],<br><br>First impressions matter, and in [Lead_Location], a strong visual identity can set you apart from the competition. At [Your Company], we offer professional graphic design services that elevate your brand and leave a lasting impact.<br><br>Our services include:<br>- **Logo Design:** Crafting unique logos that reflect your brand's personality and values.<br>- **Marketing Collateral:** Designing brochures, flyers, and business cards that capture attention and communicate your message effectively.<br>- **Social Media Graphics:** Creating visually appealing graphics for your social media platforms, helping you engage with your audience.<br>- **Branding Packages:** Offering comprehensive branding solutions that ensure consistency across all your marketing materials.<br><br>Let's discuss how we can bring your vision to life. Check out our portfolio on [Lead_Website] to see examples of our work.<br><br>Regards,<br>[Your Name]"
IT Support,Reliable IT Support to Keep Your Business Running Smoothly,"Hi [Recipient's Name],<br><br>Are IT issues disrupting your workflow in [Lead_Location]? Our expert IT support team at [Your Company] is here to ensure your systems run smoothly and securely.<br><br>We offer:<br>- **24/7 Support:** Providing around-the-clock assistance to resolve any IT issues promptly.<br>- **Network Management:** Monitoring and managing your network to prevent downtime and improve efficiency.<br>- **Cybersecurity Solutions:** Implementing advanced security measures to protect your business from cyber threats.<br>- **Data Backup and Recovery:** Ensuring your data is safe and recoverable in case of emergencies.<br><br>Let's set up a call to discuss your IT needs and how we can support your business. Visit [Lead_Website] for more information.<br><br>Best,<br>[Your Name]"
Accounting Services,Simplify Your Finances with Professional Accounting Services,"Hi [Recipient's Name],<br><br>Managing finances can be challenging, especially in a competitive market like [Lead_Location]. At [Your Company], our professional accounting services can help you streamline your financial processes, ensuring accuracy and compliance.<br><br>Our services include:<br>- **Bookkeeping:** Maintaining accurate financial records to help you manage your finances effectively.<br>- **Tax Preparation:** Preparing and filing taxes to ensure compliance with all regulations.<br>- **Financial Consulting:** Providing expert advice to help you make informed business decisions.<br>- **Payroll Services:** Managing payroll processing to ensure your employees are paid accurately and on time.<br><br>Interested in learning more? Visit [Lead_Website] to schedule a consultation and see how we can help simplify your finances.<br><br>Best regards,<br>[Your Name]"
HR Consulting,Optimize Your Workforce with Expert HR Consulting,"Hi [Recipient's Name],<br><br>Struggling with HR challenges in [Lead_Location]? Our HR consulting services at [Your Company] can help you build a productive and motivated workforce.<br><br>We offer:<br>- **Recruitment:** Finding and hiring the best talent for your organization.<br>- **Employee Training:** Providing training programs to enhance skills and improve performance.<br>- **Performance Management:** Implementing systems to evaluate and improve employee performance.<br>- **HR Compliance:** Ensuring compliance with labor laws and regulations.<br><br>Let's discuss how we can support your HR needs. Visit [Lead_Website] for more details.<br><br>Regards,<br>[Your Name]"
Legal Services,Ensure Legal Compliance with Our Expert Legal Services,"Hi [Recipient's Name],<br><br>Navigating legal matters can be complex, especially for businesses in [Lead_Location]. At [Your Company], our experienced legal team provides comprehensive legal services to help you stay compliant and protected.<br><br>Our services include:<br>- **Contract Review:** Reviewing and drafting contracts to protect your interests.<br>- **Compliance:** Ensuring your business complies with all relevant laws and regulations.<br>- **Dispute Resolution:** Resolving disputes efficiently to minimize disruptions to your business.<br>- **Corporate Governance:** Advising on best practices for corporate governance and management.<br><br>Let’s schedule a consultation to discuss your legal needs. Visit [Lead_Website] to learn more about our services.<br><br>Best,<br>[Your Name]"
Business Consulting,Drive Growth with Our Expert Business Consulting Services,"Hi [Recipient's Name],<br><br>Looking to take your business to the next level? Our business consulting services at [Your Company] can provide you with the strategies and insights needed to drive growth and efficiency, especially in a competitive market like [Lead_Location].<br><br>We specialize in:<br>- **Market Analysis:** Understanding your market and identifying growth opportunities.<br>- **Business Planning:** Developing comprehensive business plans that outline your strategy and objectives.<br>- **Process Optimization:** Streamlining operations to improve efficiency and reduce costs.<br>- **Financial Advisory:** Providing expert financial advice to help you manage your finances effectively.<br><br>Let’s discuss how we can help. Visit [Lead_Website] to schedule a consultation.<br><br>Best regards,<br>[Your Name]"
Social Media Management,Amplify Your Social Media Presence with Our Expert Management Services,"Hi [Recipient's Name],<br><br>Are you maximizing your social media potential? In [Lead_Location], where digital engagement is key, our social media management services at [Your Company] can help you engage with your audience and grow your following.<br><br>We offer:<br>- **Content Creation:** Crafting engaging content that resonates with your audience.<br>- **Scheduling:** Managing your social media calendar to ensure consistent posting.<br>- **Analytics:** Tracking performance metrics to optimize your social media strategy.<br>- **Community Management:** Engaging with your audience and building a loyal community.<br><br>Interested in a free social media audit? Visit [Lead_Website] to learn more.<br><br>Cheers,<br>[Your Name]"
Event Planning,Make Your Next Event Unforgettable with Our Planning Services,"Hi [Recipient's Name],<br><br>Planning an event can be stressful, but not with [Your Company] by your side. Whether you're in [Lead_Location] or beyond, our experienced event planners can handle everything from venue selection to logistics, ensuring a memorable experience for your guests.<br><br>We specialize in:<br>- **Corporate Events:** Planning and executing conferences, seminars, and corporate parties.<br>- **Weddings:** Creating unforgettable wedding experiences tailored to your vision.<br>- **Special Occasions:** Managing birthdays, anniversaries, and other special events.<br>- **Logistics and Coordination:** Ensuring all aspects of your event run smoothly.<br><br>Let’s discuss your upcoming event and how we can help. Visit [Lead_Website] for more details.<br><br>Best,<br>[Your Name]"
Content Writing,Enhance Your Brand's Voice with Professional Content Writing Services,"Hi [Recipient's Name],<br><br>Struggling to find the right words? At [Your Company], our professional content writing services can help you create compelling and engaging content for your website, blog, and marketing materials. Especially in [Lead_Location], where competition is fierce, effective communication is key.<br><br>Our services include:<br>- **Website Content:** Crafting clear and persuasive content that communicates your brand's message.<br>- **Blog Writing:** Providing insightful and engaging blog posts that attract and retain readers.<br>- **Copywriting:** Creating impactful copy for advertisements, emails, and more.<br>- **SEO Writing:** Optimizing content for search engines to improve your online visibility.<br><br>Let’s schedule a call to discuss your content needs. Visit [Lead_Website] to see examples of our work.<br><br>Best regards,<br>[Your Name]"
SEO Services,Improve Your Search Rankings with Expert SEO Services,"Hi [Recipient's Name],<br><br> Want to rank higher on search engines? Our SEO experts can help you improve your website’s visibility and drive organic traffic. We offer keyword research, on-page optimization, and link building. Let’s schedule a call to discuss your SEO strategy.<br><br> Cheers,<br> [Your Name]"
Virtual Assistance,Increase Efficiency with Our Professional Virtual Assistance Services,"Hi [Recipient's Name],<br><br> Need help managing your day-to-day tasks? Our virtual assistants can provide administrative support, customer service, and more, allowing you to focus on what matters most. Interested in learning how we can assist you?<br><br> Best,<br> [Your Name]"
Cybersecurity,Protect Your Business with Advanced Cybersecurity Solutions,"Hi [Recipient's Name],<br><br> Concerned about cyber threats? Our advanced cybersecurity solutions can protect your business from data breaches and cyberattacks. We offer risk assessments, threat monitoring, and incident response. Let’s discuss your cybersecurity needs.<br><br> Regards,<br> [Your Name]"
Logistics Services,Streamline Your Supply Chain with Our Logistics Services,"Hi [Recipient's Name],<br><br> Is your supply chain efficient? Our logistics services can help you streamline operations and reduce costs. We offer warehousing, transportation, and inventory management. Let’s schedule a call to discuss how we can optimize your supply chain.<br><br> Best,<br> [Your Name]"
Translation Services,Break Language Barriers with Professional Translation Services,"Hi [Recipient's Name],<br><br> Need to communicate effectively across languages? Our professional translation services can help you reach a global audience. We offer translation, localization, and interpretation services. Let’s discuss your translation needs.<br><br> Best regards,<br> [Your Name]"
PR Services,Elevate Your Brand with Expert PR Services,"Hi [Recipient's Name],<br><br> Looking to boost your brand’s visibility? Our PR services can help you generate positive media coverage and enhance your reputation. We offer media relations, press releases, and crisis management. Let’s schedule a consultation to discuss your PR strategy.<br><br> Regards,<br> [Your Name]"
Market Research,Gain Insights with Our Professional Market Research Services,"Hi [Recipient's Name],<br><br> Want to understand your market better? Our market research services provide valuable insights into customer behavior, industry trends, and competitive analysis. Let’s discuss how we can help you make informed business decisions.<br><br> Best,<br> [Your Name]"
Video Production,Engage Your Audience with Professional Video Production Services,"Hi [Recipient's Name],<br><br> Ready to captivate your audience? Our professional video production services can help you create high-quality videos for marketing, training, and more. We offer scriptwriting, filming, and editing. Let’s discuss your video project.<br><br> Cheers,<br> [Your Name]"
E-commerce Solutions,Enhance Your Online Sales with Our E-commerce Solutions,"Hi [Recipient's Name],<br><br> Looking to boost your online sales? Our e-commerce solutions can help you build and optimize your online store for maximum conversions. We offer platform integration, payment processing, and inventory management. Interested in a free consultation?<br><br> Best regards,<br> [Your Name]"
Pay-Per-Click (PPC) Ads,Increase Leads with Effective PPC Campaigns,"Hi [Recipient Name],<br><br>Are you getting the most out of your advertising budget? At [Your Company], we specialize in creating and managing PPC campaigns that deliver results. Our data-driven approach ensures your ads reach the right audience, generating high-quality leads and maximizing ROI. Let’s discuss how we can optimize your PPC strategy for better performance.<br><br>Best regards,<br>[Your Name]"
Mobile App Development,Launch Your Mobile App with Expert Development,"Hi [Recipient Name],<br><br>Do you have a mobile app idea but need help bringing it to life? Our experienced developers at [Your Company] can turn your vision into a reality. We offer end-to-end mobile app development services, from concept to launch. Whether you need an app for iOS, Android, or both, we ensure a seamless user experience and robust functionality. Let’s create something amazing together.<br><br>Best regards,<br>[Your Name]"
Email Marketing,Boost Engagement with Targeted Email Campaigns,"Hi [Recipient Name],<br><br>Looking to improve your email marketing results? [Your Company] offers targeted email campaigns designed to boost engagement and drive conversions. Our services include list management, personalized email content, and performance tracking. Let us help you create effective email marketing strategies that resonate with your audience. Contact us today.<br><br>Best regards,<br>[Your Name]"
CRM Implementation,Streamline Your Sales with CRM Solutions,"Hi [Recipient Name],<br><br>Are you looking to streamline your sales and customer management processes? [Your Company] specializes in CRM implementation and customization. We help businesses of all sizes adopt and optimize CRM systems, ensuring better customer relationships and improved sales efficiency. Let’s discuss how we can enhance your CRM strategy.<br><br>Best regards,<br>[Your Name]"
Brand Strategy Consulting,Elevate Your Brand with Expert Strategy Consulting,"Hi [Recipient Name],<br><br>Is your brand strategy aligned with your business goals? [Your Company] offers expert brand strategy consulting to help you define and communicate your brand effectively. From market research to positioning and messaging, we ensure your brand stands out in a crowded marketplace. Let’s collaborate to elevate your brand and drive business growth.<br><br>Best regards,<br>[Your Name]"
Cloud Services,Optimize Your Operations with Cloud Solutions,"Hi [Recipient Name],<br><br>Is your business ready to leverage the power of the cloud? [Your Company] provides comprehensive cloud services, including migration, management, and security. Our solutions are designed to optimize your operations, reduce costs, and improve scalability. Let’s discuss how we can help you transition to the cloud seamlessly.<br><br>Best regards,<br>[Your Name]"
Automation Software Tools,Streamline Your Operations with Automation Tools,"Hi [Recipient Name],<br><br>Are you looking to streamline your business operations and increase efficiency? Our advanced automation software tools at [Your Company] can help you achieve just that. Our solutions are designed to automate repetitive tasks, reduce manual errors, and save valuable time for your team. With features like workflow automation, process optimization, and real-time analytics, our tools can transform the way you work. Let us help you unlock the full potential of automation to drive productivity and growth in your organization. Contact us today to learn more about how our automation solutions can benefit your business.<br><br>Best regards,<br>[Your Name]"
