Service,Subject,Template
Digital Marketing,Boost Your Online Presence with Expert Digital Marketing Services!,"Hi [Recipient's Name],<br><br>I hope this email finds you well. As a business located in [Lead_Location], it's crucial to have a strong online presence to attract and engage potential customers. At [Your Company], we specialize in comprehensive digital marketing services tailored to meet your unique business needs.<br><br>Our services include:<br>- **SEO Optimization:** Improve your website's visibility and organic search rankings, driving more traffic and potential customers.<br>- **Social Media Marketing:** Engage with your audience on platforms like Facebook, Instagram, and LinkedIn, building a loyal customer base.<br>- **PPC Campaigns:** Target specific audiences with precision, maximizing your ROI and increasing conversions.<br>- **Content Marketing:** Craft compelling content that resonates with your audience and establishes your brand as an industry authority.<br><br>Let's schedule a call to discuss how we can help you enhance your online presence and achieve your business goals. Feel free to check our website [Lead_Website] and see our client testimonials and case studies.<br><br>Looking forward to our conversation.<br><br>Best regards,<br>[Your Name]"
Web Development,Transform Your Website into a Lead-Generating Machine,"Hi [Recipient's Name],<br><br>Is your website effectively converting visitors into customers? At [Your Company], we offer cutting-edge web development services that transform your online presence. Located in [Lead_Location], we understand the local market and can tailor our solutions to meet your needs.<br><br>Our web development services include:<br>- **Responsive Design:** Ensuring your website looks great on all devices, from desktops to smartphones.<br>- **SEO Integration:** Building SEO-friendly websites that rank well in search engine results.<br>- **User Experience (UX) Design:** Creating intuitive and engaging user interfaces that keep visitors on your site.<br>- **E-commerce Solutions:** Developing robust online stores that drive sales and provide a seamless shopping experience.<br><br>Interested in a free consultation to discuss how we can help your business thrive online? Visit [Lead_Website] to learn more about our services and success stories.<br><br>Cheers,<br>[Your Name]"
Graphic Design,Elevate Your Brand with Professional Graphic Design Services,"Hi [Recipient's Name],<br><br>First impressions matter, and in [Lead_Location], a strong visual identity can set you apart from the competition. At [Your Company], we offer professional graphic design services that elevate your brand and leave a lasting impact.<br><br>Our services include:<br>- **Logo Design:** Crafting unique logos that reflect your brand's personality and values.<br>- **Marketing Collateral:** Designing brochures, flyers, and business cards that capture attention and communicate your message effectively.<br>- **Social Media Graphics:** Creating visually appealing graphics for your social media platforms, helping you engage with your audience.<br>- **Branding Packages:** Offering comprehensive branding solutions that ensure consistency across all your marketing materials.<br><br>Let's discuss how we can bring your vision to life. Check out our portfolio on [Lead_Website] to see examples of our work.<br><br>Regards,<br>[Your Name]"
IT Support,Reliable IT Support to Keep Your Business Running Smoothly,"Hi [Recipient's Name],<br><br>Are IT issues disrupting your workflow in [Lead_Location]? Our expert IT support team at [Your Company] is here to ensure your systems run smoothly and securely.<br><br>We offer:<br>- **24/7 Support:** Providing around-the-clock assistance to resolve any IT issues promptly.<br>- **Network Management:** Monitoring and managing your network to prevent downtime and improve efficiency.<br>- **Cybersecurity Solutions:** Implementing advanced security measures to protect your business from cyber threats.<br>- **Data Backup and Recovery:** Ensuring your data is safe and recoverable in case of emergencies.<br><br>Let's set up a call to discuss your IT needs and how we can support your business. Visit [Lead_Website] for more information.<br><br>Best,<br>[Your Name]"
Accounting Services,Simplify Your Finances with Professional Accounting Services,"Hi [Recipient's Name],<br><br>Managing finances can be challenging, especially in a competitive market like [Lead_Location]. At [Your Company], our professional accounting services can help you streamline your financial processes, ensuring accuracy and compliance.<br><br>Our services include:<br>- **Bookkeeping:** Maintaining accurate financial records to help you manage your finances effectively.<br>- **Tax Preparation:** Preparing and filing taxes to ensure compliance with all regulations.<br>- **Financial Consulting:** Providing expert advice to help you make informed business decisions.<br>- **Payroll Services:** Managing payroll processing to ensure your employees are paid accurately and on time.<br><br>Interested in learning more? Visit [Lead_Website] to schedule a consultation and see how we can help simplify your finances.<br><br>Best regards,<br>[Your Name]"
HR Consulting,Optimize Your Workforce with Expert HR Consulting,"Hi [Recipient's Name],<br><br>Struggling with HR challenges in [Lead_Location]? Our HR consulting services at [Your Company] can help you build a productive and motivated workforce.<br><br>We offer:<br>- **Recruitment:** Finding and hiring the best talent for your organization.<br>- **Employee Training:** Providing training programs to enhance skills and improve performance.<br>- **Performance Management:** Implementing systems to evaluate and improve employee performance.<br>- **HR Compliance:** Ensuring compliance with labor laws and regulations.<br><br>Let's discuss how we can support your HR needs. Visit [Lead_Website] for more details.<br><br>Regards,<br>[Your Name]"
Legal Services,Ensure Legal Compliance with Our Expert Legal Services,"Hi [Recipient's Name],<br><br>Navigating legal matters can be complex, especially for businesses in [Lead_Location]. At [Your Company], our experienced legal team provides comprehensive legal services to help you stay compliant and protected.<br><br>Our services include:<br>- **Contract Review:** Reviewing and drafting contracts to protect your interests.<br>- **Compliance:** Ensuring your business complies with all relevant laws and regulations.<br>- **Dispute Resolution:** Resolving disputes efficiently to minimize disruptions to your business.<br>- **Corporate Governance:** Advising on best practices for corporate governance and management.<br><br>Let’s schedule a consultation to discuss your legal needs. Visit [Lead_Website] to learn more about our services.<br><br>Best,<br>[Your Name]"
Business Consulting,Drive Growth with Our Expert Business Consulting Services,"Hi [Recipient's Name],<br><br>Looking to take your business to the next level? Our business consulting services at [Your Company] can provide you with the strategies and insights needed to drive growth and efficiency, especially in a competitive market like [Lead_Location].<br><br>We specialize in:<br>- **Market Analysis:** Understanding your market and identifying growth opportunities.<br>- **Business Planning:** Developing comprehensive business plans that outline your strategy and objectives.<br>- **Process Optimization:** Streamlining operations to improve efficiency and reduce costs.<br>- **Financial Advisory:** Providing expert financial advice to help you manage your finances effectively.<br><br>Let’s discuss how we can help. Visit [Lead_Website] to schedule a consultation.<br><br>Best regards,<br>[Your Name]"
Social Media Management,Amplify Your Social Media Presence with Our Expert Management Services,"Hi [Recipient's Name],<br><br>Are you maximizing your social media potential? In [Lead_Location], where digital engagement is key, our social media management services at [Your Company] can help you engage with your audience and grow your following.<br><br>We offer:<br>- **Content Creation:** Crafting engaging content that resonates with your audience.<br>- **Scheduling:** Managing your social media calendar to ensure consistent posting.<br>- **Analytics:** Tracking performance metrics to optimize your social media strategy.<br>- **Community Management:** Engaging with your audience and building a loyal community.<br><br>Interested in a free social media audit? Visit [Lead_Website] to learn more.<br><br>Cheers,<br>[Your Name]"
Event Planning,Make Your Next Event Unforgettable with Our Planning Services,"Hi [Recipient's Name],<br><br>Planning an event can be stressful, but not with [Your Company] by your side. Whether you're in [Lead_Location] or beyond, our experienced event planners can handle everything from venue selection to logistics, ensuring a memorable experience for your guests.<br><br>We specialize in:<br>- **Corporate Events:** Planning and executing conferences, seminars, and corporate parties.<br>- **Weddings:** Creating unforgettable wedding experiences tailored to your vision.<br>- **Special Occasions:** Managing birthdays, anniversaries, and other special events.<br>- **Logistics and Coordination:** Ensuring all aspects of your event run smoothly.<br><br>Let’s discuss your upcoming event and how we can help. Visit [Lead_Website] for more details.<br><br>Best,<br>[Your Name]"
Content Writing,Enhance Your Brand's Voice with Professional Content Writing Services,"Hi [Recipient's Name],<br><br>Struggling to find the right words? At [Your Company], our professional content writing services can help you create compelling and engaging content for your website, blog, and marketing materials. Especially in [Lead_Location], where competition is fierce, effective communication is key.<br><br>Our services include:<br>- **Website Content:** Crafting clear and persuasive content that communicates your brand's message.<br>- **Blog Writing:** Providing insightful and engaging blog posts that attract and retain readers.<br>- **Copywriting:** Creating impactful copy for advertisements, emails, and more.<br>- **SEO Writing:** Optimizing content for search engines to improve your online visibility.<br><br>Let’s schedule a call to discuss your content needs. Visit [Lead_Website] to see examples of our work.<br><br>Best regards,<br>[Your Name]"
SEO Services,Improve Your Search Rankings with Expert SEO Services,"Hi [Recipient's Name],<br><br>Are you struggling to get your business noticed online? At [Your Company], we specialize in helping businesses like yours improve their search engine rankings and attract more customers. Based in [Lead_Location], your company has the potential to reach a broader audience with a solid SEO strategy.<br><br>Our team of experts can conduct a thorough analysis of your website, identify the right keywords, and optimize your content to ensure you rank higher on search results. With our proven strategies, we have helped businesses like yours enhance their online presence, leading to increased traffic and conversions.<br><br>Let's discuss how we can tailor our SEO services to meet your specific needs. Whether you're looking to optimize your website's on-page elements or build high-quality backlinks, we have the tools and expertise to help you succeed.<br><br>Looking forward to hearing from you!<br>Cheers,<br>[Your Name]<br>[Your Contact Information]"
Virtual Assistance,Increase Efficiency with Our Professional Virtual Assistance Services,"Hi [Recipient's Name],<br><br>Managing your business tasks can be overwhelming, especially when you're trying to focus on growth. At [Your Company], we offer professional virtual assistance services designed to support your daily operations and streamline your workflow.<br><br>Based in [Lead_Location], we understand the unique challenges businesses face in your area. Our team of experienced virtual assistants can handle everything from administrative tasks and customer service to scheduling and social media management, giving you more time to focus on strategic initiatives.<br><br>We pride ourselves on delivering high-quality service tailored to your specific needs. With our virtual assistance services, you can expect increased efficiency, better time management, and enhanced customer satisfaction. Plus, with excellent ratings and reviews, we are committed to maintaining the highest standards of professionalism.<br><br>Interested in learning more about how we can help you? Let's schedule a call to discuss your needs and how our services can support your business growth.<br><br>Best,<br>[Your Name]<br>[Your Contact Information]"
Cybersecurity,Protect Your Business with Advanced Cybersecurity Solutions,"Hi [Recipient's Name],<br><br>In today's digital age, cybersecurity is more critical than ever. At [Your Company], we offer advanced cybersecurity solutions to protect your business from cyber threats. Located in [Lead_Location], your company is uniquely positioned to benefit from our services, which are tailored to meet the needs of businesses in your region.<br><br>Our comprehensive approach includes risk assessments, threat monitoring, and incident response. We can help you safeguard sensitive data, maintain regulatory compliance, and ensure business continuity. With our expertise and state-of-the-art technology, you can have peace of mind knowing that your business is secure.<br><br>We have a proven track record of success, with numerous satisfied clients who have benefited from our services. Our solutions are designed to be scalable and adaptable, ensuring that they grow with your business. We invite you to check out our [Lead_Reviews] and see how we've helped other companies like yours.<br><br>Let's connect to discuss your cybersecurity needs and how we can help you build a robust defense against potential threats.<br><br>Regards,<br>[Your Name]<br>[Your Contact Information]"
